{
  "schema_version": "1.0.0",
  "snapshot_id": "declared-synthetic-001",
  "subject_id": "synthetic-subject-alpha",
  "configuration_digest": "sha256:abababababababababababababababababababababababababababababababab",
  "declared_at": "2026-10-15T00:00:00Z",
  "declarer_ref": "synthetic-declarer",
  "statement": "declared synthetic baseline",
  "reference_only": true,
  "authority_effect": "NONE"
}
